{
  "$schema": "http://json-schema.org/draft-07/schema#",
  "title": "Feature List v1.0 \u2014 5-Level",
  "type": "object",
  "required": [
    "version",
    "features"
  ],
  "properties": {
    "version": {
      "type": "string"
    },
    "baseRevision": {
      "type": "integer",
      "minimum": 0,
      "default": 0
    },
    "goals": {
      "type": "array",
      "default": [],
      "items": {
        "type": "object",
        "required": [
          "id",
          "title"
        ],
        "properties": {
          "id": {
            "type": "string"
          },
          "title": {
            "type": "string"
          },
          "description": {
            "type": "string",
            "default": ""
          }
        }
      }
    },
    "sprints": {
      "type": "array",
      "default": [],
      "items": {
        "type": "object",
        "required": [
          "id",
          "name"
        ],
        "properties": {
          "id": {
            "type": "string"
          },
          "name": {
            "type": "string"
          },
          "goalId": {
            "type": "string"
          },
          "difficulty": {
            "type": "string",
            "enum": [
              "easy",
              "moderate",
              "difficult"
            ]
          }
        }
      }
    },
    "features": {
      "type": "array",
      "items": {
        "type": "object",
        "required": [
          "id",
          "name",
          "passes",
          "tasks"
        ],
        "properties": {
          "id": {
            "type": "string"
          },
          "name": {
            "type": "string"
          },
          "description": {
            "type": "string"
          },
          "passes": {
            "type": "boolean"
          },
          "sprintId": {
            "type": "string"
          },
          "goalId": {
            "type": "string"
          },
          "definitionOfDone": {
            "type": "array",
            "items": {
              "type": "string"
            },
            "default": []
          },
          "producedByRole": {
            "type": [
              "string",
              "null"
            ],
            "enum": [
              null,
              "planner",
              "generator",
              "evaluator",
              "simplifier"
            ],
            "default": null
          },
          "coversCriteria": {
            "type": "array",
            "items": {
              "type": "integer"
            },
            "default": []
          },
          "tasks": {
            "type": "array",
            "items": {
              "type": "object",
              "required": [
                "id",
                "description",
                "status"
              ],
              "properties": {
                "id": {
                  "type": "string"
                },
                "key": {
                  "type": "string"
                },
                "description": {
                  "type": "string"
                },
                "status": {
                  "type": "string",
                  "enum": [
                    "pending",
                    "in_progress",
                    "complete",
                    "blocked",
                    "rework"
                  ]
                },
                "acceptanceCriteria": {
                  "type": "array",
                  "items": {
                    "type": "string"
                  },
                  "default": []
                },
                "producedByRole": {
                  "type": [
                    "string",
                    "null"
                  ],
                  "enum": [
                    null,
                    "planner",
                    "generator",
                    "evaluator",
                    "simplifier"
                  ],
                  "default": null
                },
                "dependsOn": {
                  "type": "array",
                  "items": {
                    "type": "string"
                  },
                  "default": []
                },
                "subtasks": {
                  "type": "array",
                  "default": [],
                  "items": {
                    "type": "object",
                    "required": [
                      "id",
                      "title",
                      "status"
                    ],
                    "properties": {
                      "id": {
                        "type": "string"
                      },
                      "title": {
                        "type": "string"
                      },
                      "status": {
                        "type": "string",
                        "enum": [
                          "pending",
                          "in_progress",
                          "complete"
                        ]
                      }
                    }
                  }
                },
                "difficulty": {
                  "type": "string",
                  "enum": [
                    "easy",
                    "moderate",
                    "difficult"
                  ]
                },
                "modelHint": {
                  "type": "string"
                },
                "phase": {
                  "type": "string",
                  "enum": [
                    "init",
                    "research",
                    "define",
                    "plan",
                    "build",
                    "verify",
                    "simplify",
                    "review",
                    "ship"
                  ]
                },
                "criteria": {
                  "type": "array",
                  "items": {
                    "type": "string"
                  },
                  "default": []
                },
                "serialize": {
                  "type": "boolean"
                }
              }
            }
          },
          "difficulty": {
            "type": "string",
            "enum": [
              "easy",
              "moderate",
              "difficult"
            ]
          },
          "phase": {
            "type": "string",
            "enum": [
              "init",
              "research",
              "define",
              "plan",
              "build",
              "verify",
              "simplify",
              "review",
              "ship"
            ]
          },
          "criteria": {
            "type": "array",
            "items": {
              "type": "string"
            },
            "default": []
          }
        }
      }
    }
  }
}
