{
  "version": "0.1",
  "baseRevision": 2,
  "goals": [
    {
      "id": "goal-001",
      "title": "pi-harness v1.0 — superset visual harness",
      "description": "Enforced, 5-level, compaction-safe, worker-isolated"
    }
  ],
  "sprints": [
    {
      "id": "sprint-001",
      "name": "F1 — Visual 5-Level Widget + baseRevision",
      "goalId": "goal-001"
    },
    {
      "id": "sprint-002",
      "name": "F2 — Enforcer Auto-Loop Hardening",
      "goalId": "goal-001"
    },
    {
      "id": "sprint-003",
      "name": "F3 — Worker Isolation per BUILD Task",
      "goalId": "goal-001"
    },
    {
      "id": "sprint-004",
      "name": "F4 — Goal Loop with GOAL_SPEC.json + Reviewer Worker",
      "goalId": "goal-001"
    },
    {
      "id": "sprint-005",
      "name": "F5 — Remote Read-Only Web View → 1.0.0",
      "goalId": "goal-001"
    },
    {
      "id": "sprint-006",
      "name": "F6 — Resilient Self-Correction → 1.1.0",
      "goalId": "goal-001"
    }
  ],
  "features": [
    {
      "id": "feature-001",
      "name": "Visual 5-Level Widget + baseRevision",
      "description": "Pi TUI widget showing Goal→Feature→Sprint→Task→Subtask with rolling window, deps, and compaction-safe atomic state",
      "passes": true,
      "producedByRole": "generator",
      "sprintId": "sprint-001",
      "goalId": "goal-001",
      "definitionOfDone": [
        "Widget renders 5 levels with ○●◐⚠↷, Progress, +3 more, ← #1 deps, wraps long labels",
        "harness/feature-list.json has baseRevision, key, dependsOn, subtasks; stale baseRevision rejected",
        "State survives /reload, /tree, and compaction via hidden checkpoint"
      ],
      "tasks": [
        {
          "id": "task-001",
          "key": "schema-5level",
          "description": "Extend feature-list schema to 5 levels with baseRevision",
          "status": "complete",
          "acceptanceCriteria": [
            "harness/features/feature-list.json has baseRevision, tasks have key, dependsOn, subtasks",
            "harness/features/feature-list.schema.json updated and validates",
            "Existing pi-harness harness still loads"
          ],
          "dependsOn": [],
          "subtasks": [
            {
              "id": "st-001",
              "title": "Add baseRevision, goals, sprints to top-level",
              "status": "complete"
            },
            {
              "id": "st-002",
              "title": "Add key, dependsOn, subtasks to tasks",
              "status": "complete"
            }
          ]
        },
        {
          "id": "task-002",
          "key": "widget-render",
          "description": "Port widget rendering (task-tracker + long-task) to src/widget.ts",
          "status": "complete",
          "acceptanceCriteria": [
            "src/widget.ts implements getWidgetWindowBounds, wrapWidgetLines, statusIcon, rolling window",
            "Widget shows Goal→Feature→Sprint→Task→Subtask with Progress and +3 more overflow",
            "Long labels wrap not truncate, deps shown as ← #1"
          ],
          "dependsOn": [
            "schema-5level"
          ],
          "subtasks": [
            {
              "id": "st-003",
              "title": "Port getWidgetWindowBounds and wrapWidgetLines",
              "status": "complete"
            }
          ]
        },
        {
          "id": "task-003",
          "key": "atomic-tool",
          "description": "Implement harness_task_list tool with atomic baseRevision and hidden checkpoint",
          "status": "complete",
          "acceptanceCriteria": [
            "harness_task_list({baseRevision, tasks}) does omission=deletion, baseRevision check, cycle/missing dep check",
            "in_progress needs deps completed, all-or-nothing, hidden custom checkpoint on compaction",
            "Widget survives /reload and /tree via toolResult.details replay"
          ],
          "dependsOn": [
            "widget-render"
          ],
          "subtasks": []
        }
      ],
      "coversCriteria": [
        1,
        2,
        3
      ]
    },
    {
      "id": "feature-002",
      "name": "Enforcer Auto-Loop Hardening",
      "description": "Harden harness-enforcer to full auto-loop without stream race",
      "passes": true,
      "producedByRole": "generator",
      "sprintId": "sprint-002",
      "goalId": "goal-001",
      "definitionOfDone": [
        "session_start notify+widget without mid-stream sendUserMessage survives reload",
        "context injects hidden checkpoint after compaction and reminder every 3 calls",
        "tool_call blocks phase-skip and session_before_compact checkpoint stored, tsc clean"
      ],
      "tasks": [
        {
          "id": "task-004",
          "key": "loop-hardening",
          "description": "Harden enforcer loop: context checkpoint + reminder + tool guard",
          "status": "complete",
          "acceptanceCriteria": [
            "session_start and context and session_before_compact work without sendUserMessage mid-stream",
            "tool_call blocks harness/config.json phase-skip without PASS, tsc --noEmit passes",
            "package.json version bumps to 0.3.0 and CHANGELOG updated"
          ],
          "dependsOn": [],
          "subtasks": []
        }
      ],
      "coversCriteria": [
        1,
        2,
        3
      ]
    },
    {
      "id": "feature-003",
      "name": "Worker Isolation per BUILD Task",
      "description": "Isolated worker per BUILD task with tmp/pi-harness/<run-id>/ attempt history and proper-lockfile",
      "passes": true,
      "producedByRole": "generator",
      "sprintId": "sprint-003",
      "goalId": "goal-001",
      "definitionOfDone": [
        "src/worker.ts provides worker dirs and proper-lockfile isolation, tests pass and tsc clean",
        "Worker attempt history tmp/pi-harness/<run-id>/... written by dev-harness run workers, baseRevision preserved",
        "Version 0.4.0 with changelog, enforcer stays notify-only without stream race"
      ],
      "tasks": [
        {
          "id": "task-005",
          "key": "worker-isolation",
          "description": "Build src/worker.ts isolation with proper-lockfile, attempt history, fingerprint and unit tests",
          "status": "complete",
          "acceptanceCriteria": [
            "src/worker.ts implements createWorkerRunDir, recordAttempt, fingerprint with proper-lockfile isolation",
            "tests/worker.test.ts passes (dir creation, attempt N, lock, baseRevision, fingerprint)",
            "npx tsc --noEmit passes with no sendUserMessage mid-stream regression"
          ],
          "dependsOn": [],
          "subtasks": []
        },
        {
          "id": "task-006",
          "key": "worker-wire",
          "description": "Wire worker to enforcer and bump to 0.4.0 with changelog",
          "status": "complete",
          "acceptanceCriteria": [
            "enforcer exposes worker helper and dev-harness run workers write tmp/pi-harness/<run-id>/ isolated prompts",
            "package.json version 0.4.0 and CHANGELOG ## [0.4.0] entry",
            "enforcer still tsc clean, gateHistory not leaked to main session beyond expected"
          ],
          "dependsOn": [
            "worker-isolation"
          ],
          "subtasks": []
        }
      ],
      "coversCriteria": [
        1,
        2,
        3
      ]
    },
    {
      "id": "feature-004",
      "name": "Goal Loop with GOAL_SPEC.json + Reviewer Worker",
      "description": "Pi-native goal loop porting pi-long-task GOAL_SPEC + loop + state to harness/goals/GOAL_SPEC.json and tmp/pi-harness/goals/<runId>/ with isolated reviewer worker",
      "passes": true,
      "producedByRole": "generator",
      "sprintId": "sprint-004",
      "goalId": "goal-001",
      "definitionOfDone": [
        "src/goalSpec.ts, src/goalLoop.ts, src/goalState.ts provide spec/loop/state helpers with proper-lockfile and tsc clean",
        "GoalSpecification persists to harness/goals/GOAL_SPEC.json and loop writes tmp/pi-harness/goals/<runId>/GOAL_STATE.json + GOAL_TRACE.jsonl + iterations/<nn>/ with GOAL_SPEC.json mirrored and reviewer isolated to tmp/pi-harness/<runId>/review/attempt-1/",
        "Version 0.5.0 with changelog, enforcer exposes pi_goal_task via spawnIsolatedWorker without stream race"
      ],
      "tasks": [
        {
          "id": "task-007",
          "key": "goal-spec",
          "description": "Port goal_spec.ts to src/goalSpec.ts with GOAL_SPEC_SCHEMA_VERSION and markdown",
          "status": "complete",
          "acceptanceCriteria": [
            "src/goalSpec.ts implements createGoalSpecification, validateGoalSpecification, goalSpecificationToMarkdown with GOAL_SPEC_SCHEMA_VERSION=1 and traceability",
            "tests/goalSpec.test.ts passes (create, validate rejects bad schema/traceability, markdown contains Spec markers)",
            "npx tsc --noEmit passes with no sendUserMessage regression in enforcer"
          ],
          "dependsOn": [],
          "subtasks": []
        },
        {
          "id": "task-008",
          "key": "goal-loop-state",
          "description": "Port goal_loop.ts + goal_state.ts to src/goalLoop.ts + src/goalState.ts with GoalLoopState and GoalStateStore",
          "status": "complete",
          "acceptanceCriteria": [
            "src/goalLoop.ts implements GoalLoopState, DEFAULT_GOAL_LOOP_LIMITS, createGoalLoopState, startGoalIteration, recordGeneratedTodo/WorkerResult/ReviewerResult, goalLoopStopReason, validateGoalLoopState with min/max/timeout guards",
            "src/goalState.ts implements GoalStateStore with paths {goalRunDir,statePath,tracePath,resultPath,goalSpecPath,iterationsDir}, ensureRunDir, saveState/loadState, saveGoalSpecification, appendTrace, writeIterationSnapshot using atomic tmp+rename and proper-lockfile on harness/goals/GOAL_SPEC.json",